{
  "version": 1,
  "case_id": "C2",
  "status": "completed",
  "summary": "executor finished current case successfully",
  "notes": "all requested files were updated and smoke passed",
  "tests_run": [
    "python3 -m py_compile src/agent_workflow_factory/*.py"
  ],
  "tests_passed": true,
  "files_touched": [
    "src/agent_workflow_factory/loop.py",
    "README.md"
  ],
  "commit_created": false,
  "commit_message": "",
  "created_at": "2026-03-24T11:00:00"
}
